id,name,label,gloss,source
1,disembodied,Disembodied,Body absent; voice or presence only; epistolary or AI,curated
2,ethereal,Ethereal,Body present but semi-spectral; dream illness recovery,curated
3,restrained,Restrained,Body kept off-screen or covered; modesty; institutional,curated
4,felt,Felt,Body has weight and warmth; characters touch and breathe,curated
5,ailing,Ailing,Body in distress; illness exhaustion infirmity,curated
6,flesh_forward,Flesh-forward,Body insistent; nudity violence labour parturition,curated
